{
  "$schema": "https://json-schema.org/draft/2020-12/schema",
  "$id": "https://local.invalid/jjfb/launcher_profile.schema.json",
  "title": "Mythroad/GWY Launcher Compatibility Profile",
  "type": "object",
  "required": ["id", "resource_root", "target", "launch", "identity", "display"],
  "properties": {
    "schema_version": {"type": "integer", "const": 1},
    "id": {"type": "string", "pattern": "^[a-z0-9._-]+$"},
    "profile_id": {"type": "string"},
    "resource_root": {"type": "string"},
    "match": {
      "type": "object",
      "properties": {
        "target": {"type": "string"},
        "appid": {"type": "integer"},
        "appver": {"type": "integer"},
        "sha256": {"type": "string", "pattern": "^[0-9a-fA-F]{64}$"}
      },
      "additionalProperties": false
    },
    "target": {
      "type": "object",
      "required": ["mrp", "entry_member"],
      "properties": {
        "mrp": {"type": "string"},
        "entry_member": {"type": "string"},
        "expected_sha256": {"type": "string", "pattern": "^[0-9a-fA-F]{64}$"},
        "appid": {"type": "integer"},
        "appver": {"type": "integer"}
      },
      "additionalProperties": false
    },
    "launch": {
      "type": "object",
      "required": ["source", "cfg_index", "params"],
      "properties": {
        "source": {"enum": ["cfg.bin", "explicit"]},
        "cfg_index": {"type": "integer", "minimum": 0},
        "params": {
          "type": "object",
          "required": ["napptype", "nextid", "ncode", "narg", "narg1", "nmrpname", "flags"],
          "properties": {
            "napptype": {"type": "integer"},
            "nextid": {"type": "integer"},
            "ncode": {"type": "integer"},
            "narg": {"type": "integer"},
            "narg1": {"type": "integer"},
            "nmrpname": {"type": "string"},
            "flags": {"type": "array", "items": {"type": "string"}}
          },
          "additionalProperties": false
        }
      },
      "additionalProperties": false
    },
    "identity": {
      "type": "object",
      "required": ["vmver", "imei", "manufacturer", "model"],
      "properties": {
        "vmver": {"type": "integer"},
        "imei": {"type": "string"},
        "manufacturer": {"type": "string"},
        "model": {"type": "string"}
      },
      "additionalProperties": false
    },
    "display": {
      "type": "object",
      "required": ["guest_width", "guest_height", "window_width", "window_height", "pixel_format"],
      "properties": {
        "guest_width": {"type": "integer"},
        "guest_height": {"type": "integer"},
        "window_width": {"type": "integer"},
        "window_height": {"type": "integer"},
        "pixel_format": {"enum": ["RGB565"]}
      },
      "additionalProperties": false
    },
    "compatibility": {
      "type": "object",
      "properties": {
        "mrp_member_aliases": {"type": "object", "additionalProperties": {"type": "string"}},
        "member_aliases": {"type": "object", "additionalProperties": {"type": "string"}},
        "accepted_entry_returns": {"type": "array", "items": {"type": "integer"}},
        "notes": {"type": "array", "items": {"type": "string"}}
      },
      "additionalProperties": false
    },
    "path_a_response": {
      "type": "object",
      "properties": {
        "initial_record": {
          "type": "object",
          "properties": {
            "enabled": {"type": "boolean"},
            "tag": {"type": "integer", "minimum": 0},
            "name": {"type": "string", "maxLength": 63},
            "secondary": {"type": "string", "maxLength": 63},
            "field_c": {"type": "integer", "minimum": 0},
            "field_d": {"type": "integer", "minimum": 0},
            "deliver_once_per_generation": {"type": "boolean"}
          },
          "additionalProperties": false
        }
      },
      "additionalProperties": false
    },
    "mrp_member_aliases": {"type": "object", "additionalProperties": {"type": "string"}}
  },
  "additionalProperties": false
}
