{
  "schema_version": 1,
  "id": "jjfb-400101-v12-original",
  "profile_id": "jjfb-400101-v12-original",
  "resource_root": "game_files/mythroad/320x480",
  "match": {
    "target": "gwy/jjfb.mrp",
    "appid": 400101,
    "appver": 12,
    "sha256": "52c13182f87f5ba14bed64589e7f47cb2860a56b32c91fdb25ab13467d5fc036"
  },
  "target": {
    "mrp": "gwy/jjfb.mrp",
    "entry_member": "start.mr",
    "expected_sha256": "52c13182f87f5ba14bed64589e7f47cb2860a56b32c91fdb25ab13467d5fc036",
    "appid": 400101,
    "appver": 12
  },
  "launch": {
    "source": "cfg.bin",
    "cfg_index": 36,
    "params": {
      "napptype": 12,
      "nextid": 482,
      "ncode": 512,
      "narg": 0,
      "narg1": 1,
      "nmrpname": "gwy/jjfb.mrp",
      "flags": ["gwyblink"]
    }
  },
  "identity": {
    "vmver": 1968,
    "imei": "864086040622841",
    "manufacturer": "vmrp",
    "model": "vmrp"
  },
  "display": {
    "guest_width": 240,
    "guest_height": 320,
    "window_width": 320,
    "window_height": 480,
    "pixel_format": "RGB565"
  },
    "compatibility": {
      "mrp_member_aliases": {
        "cfunction.ext": "robotol.ext"
      },
      "member_aliases": {
        "cfunction.ext": "robotol.ext"
      },
      "accepted_entry_returns": [0, 1],
      "notes": [
        "Alias is MRP_MEMBER scope only — never remaps DSM host cfunction.ext.",
        "Exact member match always wins over alias."
      ]
    },
    "path_a_response": {
      "initial_record": {
        "enabled": true,
        "tag": 1,
        "name": "downVersion",
        "secondary": "",
        "field_c": 0,
        "field_d": 1006,
        "deliver_once_per_generation": true
      }
    }
  }
